"artwork_dir","artwork_file","artwork_title","artwork_year","artist_name","artist_lifespan","artwork_medium","artwork_description"
"Claude_Monet","Claude Monet_1917-1919_The House among the Roses.jpg","The House among the Roses","1917-1919","Claude Monet","1840–1926","Oil on canvas","**Claude Monet** painted this late *Giverny* garden scene while struggling with advancing cataracts, a condition that distorted his color perception and broadened his already gestural brushwork into ***sweeping fields of luminous pigment***. The clambering roses of the central alley, a motif he returned to obsessively in his final decade, are rendered in vibratory strokes of pink and white that dissolve into the surrounding green. Now in the *Albertina* in Vienna, the canvas belongs to a group of garden paintings Monet produced between 1917 and 1919 as he retreated ever deeper into the precincts of *Giverny* following the deaths of his wife Alice in 1911 and his son Jean in 1914. The work anticipates the large decorative cycles he was simultaneously planning for the *Musée de l'Orangerie*."
"Claude_Monet","Claude Monet_1881_Flower Beds at Vétheuil.jpg","Flower Beds at Vétheuil","1881","Claude Monet","1840–1926","Oil on canvas","**Monet** settled at *Vétheuil*, a quiet village on the Seine between Paris and Rouen, in 1878 and remained there through 1881 in one of the most emotionally turbulent phases of his career. His first wife Camille died there in September 1879, leaving him deeply shaken; he later confessed to catching himself analytically noting the colors of her dying face, an involuntary reflection of his painterly reflexes. This sunlit view of terraced flowerbeds captures the village garden in full summer bloom, the dense plantings translated into a mosaic of warm and cool pigments that demonstrates his mastery of outdoor light despite personal grief. *Vétheuil* pictures from this period mark a decisive turn toward ***the purely optical recording of atmospheric sensation*** that would define his mature series paintings."
"Claude_Monet","Claude Monet_1918-1924_The Japanese Bridge.jpg","The Japanese Bridge","1918-1924","Claude Monet","1840–1926","Oil on canvas","**Monet** constructed his famous curved wooden bridge over the lily pond at *Giverny* in 1895, inspired by Japanese woodblock prints, but the paintings he made of it in his final years look nothing like the delicate earlier Japanese Bridge canvases. By 1918 his cataracts had severely compromised his vision; after cataract surgery in 1923 he gained new perception but was disturbed by the bluish tones he saw through his repaired eye. These late bridge paintings, now in the *Museum of Modern Art* in New York and other collections, dissolve the structure into ***a trembling architecture of color*** — orange, red, and green strokes attacking the canvas with an urgency that has been compared to the work of the Abstract Expressionists who rediscovered Monet in the 1950s. The series remains a testament to his refusal to stop painting even as his sight failed."
"Claude_Monet","Claude Monet_1908_San Giorgio Maggiore at Dusk.jpg","San Giorgio Maggiore at Dusk","1908","Claude Monet","1840–1926","Oil on canvas","**Monet** arrived in *Venice* with his wife Alice Hoschedé in October 1908, initially reluctant to paint a city so thoroughly painted before him, but the shimmering light on the lagoon soon intoxicated him. He wrote: 'What misfortune not to have come here when I was younger, when I had all the boldness. Still… I've spent delicious moments here.' Each morning the couple departed by gondola before eight o'clock, Monet setting up before the iconic island silhouette of *San Giorgio Maggiore* as the rosy dusk light transformed the distant bell tower and Palladian facade into ***a mirage of architectural mystery***. He produced 37 Venice canvases in three months and sold the entire group to the Bernheim-Jeune brothers for 12,000 francs each before he had finished retouching them."
"Claude_Monet","Claude Monet_1876_The Tuileries.jpg","The Tuileries","1876","Claude Monet","1840–1926","Oil on canvas","**Monet** included this view of the *Tuileries* gardens in his panoramic engagement with modern Parisian life during the 1870s, a period when he balanced landscape painting with scenes of bourgeois leisure in the city. Painted from an elevated vantage — likely the windows of a nearby apartment — the canvas spreads the formal chestnut allées and afternoon promenaders beneath a sky of shifting grey and silver light. It was shown at the second Impressionist exhibition in 1876, where critics acknowledged Monet's increasingly confident command of atmospheric perspective. The work is among a group of *Paris* paintings that situate **Monet** in the tradition of the modern-life painting pioneered by his friend *Édouard Manet*, though ***Monet's dissolving touch transforms cityscape into sheer sensation of light***."
"Claude_Monet","Claude Monet_1884_Cap Martin.jpg","Cap Martin","1884","Claude Monet","1840–1926","Oil on canvas","**Monet** made his first sustained campaign along the *French Riviera* in early 1884, spending time at *Bordighera* on the Italian Ligurian coast before moving westward along the coast to *Cap Martin* near *Menton*. He struggled intensely with the quality of Mediterranean light, writing to his companion Alice Hoschedé that the landscape was 'exasperating' in its profusion and that he could find no motif that fully pleased him. This rocky coastal view captures the ***brilliant clarity of southern light*** that he described as so different from the pearly, mist-filtered luminosity of Normandy, translating the jagged cape into bold chromatic contrasts of blue sea and ochre rock. The Mediterranean campaign produced a group of canvases that his dealer Durand-Ruel exhibited with commercial success."
"Claude_Monet","Claude Monet_1875_The Riverbank at Petit-Gennevilliers.jpg","The Riverbank at Petit-Gennevilliers","1875","Claude Monet","1840–1926","Oil on canvas","**Monet** lived at *Argenteuil* from 1871 to 1878, and the surrounding Seine riverscape — including the opposite bank at *Petit-Gennevilliers* — provided an inexhaustible subject for paintings that became central to the early Impressionist movement. Working from his floating studio boat, he studied how light reflected differently from still water and from the current, developing the rapid broken brushstroke that would become his signature technique. This sunlit riverside view, with its loose rendering of trees, riverbank vegetation, and rippling water, exemplifies the ***immediate, joyous plein-air sensation*** that his friend Renoir and other Impressionists sought to capture at the same location. The nearby Argenteuil regatta grounds attracted the most productive gathering of Impressionist painters in the movement's history."
"Claude_Monet","Claude Monet_1874_The Bridge at Argenteuil.jpg","The Bridge at Argenteuil","1874","Claude Monet","1840–1926","Oil on canvas","**Monet** painted more than twenty views of the *Argenteuil* road bridge and railway bridges during his years living in that riverside town, making this one of the central motifs of early Impressionism. This canvas was created in the same year as the first Impressionist exhibition, held in April 1874 in the studios of photographer *Nadar*, where **Monet**'s *Impression, Sunrise* gave the entire movement its name. The bridge arches in the middle ground create a structural counterweight to the ***shimmering dance of light on the Seine***, while sailing boats at anchor populate the foreground with casual modernity. The National Gallery of Art in Washington, D.C., holds a version of this motif."
"Claude_Monet","Claude Monet_1897_The Pointe du Petit Ailly in Gray Weather.jpg","The Pointe du Petit Ailly in Gray Weather","1897","Claude Monet","1840–1926","Oil on canvas","**Monet** made several campaigns to the *Normandy* cliffs between *Dieppe* and *Fécamp* during the 1880s and 1890s, returning in 1896-1897 to paint the dramatic coastal formations at *Varengeville* and *Pourville* in multiple weather conditions. The grey-day canvases from this campaign are among his most quietly powerful; stripped of the picturesque drama of storms or sunset, they reveal ***a purely structural account of light absorbed and reflected by chalky cliff face and heaving sea***. The *Pointe du Petit Ailly*, a headland near *Varengeville*, appears in several related canvases that **Monet** completed partially on-site and partly in his *Giverny* studio from careful studies. These Normandy coast paintings from the 1890s remain among his most prized works in private collections."
"Claude_Monet","Claude Monet_1885_Haystacks.jpg","Haystacks","1885","Claude Monet","1840–1926","Oil on canvas","**Monet** began painting the grainstacks in the fields around *Giverny* as early as 1885, several years before the famous systematic series of 1890-91 that would make the subject iconic. These earlier stacks, belonging to a neighboring farmer, appear as rounded monumentary forms in the familiar Normandy agricultural landscape, ***presaging the artist's later obsession with recording how light transforms a fixed form across time***. The 1885 canvases lack the concentrated serial purpose of the later work; **Monet** was still exploring the motif singly rather than as an orchestrated study in light variation. Nonetheless the painting reveals the visual intelligence that would eventually produce one of the most celebrated series in the history of art."
"Claude_Monet","Claude Monet_1879_Vétheuil 01.jpg","Vétheuil 01","1879","Claude Monet","1840–1926","Oil on canvas","**Monet** arrived at *Vétheuil* in 1878 with his family and the Hoschedé household, all sharing an rented farmhouse in a state of financial strain, and set about documenting the small Seine village and its church from every vantage and in every season. This 1879 view, painted the year of Camille's death in September, captures the church tower and riverside houses in the hazy summer light that he would later associate with the happiest hours of an otherwise anguished period. The white, gold, and pale blue palette that characterizes the *Vétheuil* pictures sets them apart from the darker, more turbulent winter and thaw paintings that follow; ***the summer canvases glow with a serenity that belies the grief surrounding their creation***. The *Musée Marmottan Monet* in Paris holds the finest concentration of *Vétheuil* paintings."
"Claude_Monet","Claude Monet_1879_Vétheuil 02.jpg","Vétheuil 02","1879","Claude Monet","1840–1926","Oil on canvas","**Monet** repeatedly painted the church and village of *Vétheuil* from his boat moored on the Seine, producing multiple canvases of the same townscape at different times of day throughout the seasons he lived there. This second 1879 view shows a different atmospheric moment — perhaps a different angle or time of day — from the companion canvas, demonstrating ***his emerging practice of painting the same subject under varying conditions*** that would become codified in the great series pictures of the 1890s. The *Vétheuil* church views are among Monet's finest mid-career achievements, balancing the structural clarity of the Gothic tower with the soft dissolution of light on water. Many have entered the collections of the *Musée d'Orsay* and the *Musée Marmottan Monet* in Paris."
"Claude_Monet","Claude Monet_1889_Valley of the Creuse (Gray Day).jpg","Valley of the Creuse (Gray Day)","1889","Claude Monet","1840–1926","Oil on canvas","**Monet** traveled to the remote *Creuse valley* in central France in early 1889 at the suggestion of his friend the writer *Gustave Geffroy*, and found in the wild, boulder-strewn gorge a landscape unlike anything he had previously painted — stark, elemental, and resistant to prettiness. He produced around twenty-five canvases of the *Creuse*, working in harsh late-winter conditions, and this gray-day view captures the muted palette of the valley floor with its bare oaks and brown hillsides before spring. The series was exhibited alongside Rodin's sculpture at the *Galerie Georges Petit* in June 1889 to enthusiastic critical response; the gray-day paintings particularly drew praise for ***their austere refusal of atmospheric softness***. They remain among the least-known but most admired works of his middle period."
"Claude_Monet","Claude Monet_1870-1871_On the Beach at Trouville.jpg","On the Beach at Trouville","1870-1871","Claude Monet","1840–1926","Oil on canvas","**Monet** spent the summer of 1870 at *Trouville* on the *Normandy* coast with his new wife Camille and their son Jean, painting the fashionable beach society in a series of rapid, candid studies. This beach scene, executed with a dryness and immediacy that suggests the sand-laden air of the Norman coast, likely depicts Camille seated in one of the canvas beach chairs that are characteristic of the resort. In August 1870 the Franco-Prussian War forced **Monet** to flee to London, so these *Trouville* canvases represent the final images of a carefree period in his life. Some contain literally embedded grains of sand in the paint surface, ***physical evidence of their rapid creation in the maritime air***."
"Claude_Monet","Claude Monet_1873_Railway Bridge at Argenteuil.jpg","Railway Bridge at Argenteuil","1873","Claude Monet","1840–1926","Oil on canvas","**Monet** painted the *Argenteuil* railway bridge in multiple versions during his years living in the town, celebrating the industrial infrastructure of modern France with the same aesthetic attention he gave to natural landscape. The double-arch bridge, which carried the Paris–Le Havre line over the Seine, appears here under strong afternoon light, its stone piers reflected in the water below. **Monet** was unusual among the Impressionists for his interest in railways and industry as subjects; as critic *Théodore Duret* noted in 1874, he was 'particularly drawn towards nature when it is embellished and towards urban scenes.' ***The engineering of the bridge and the velocity of its light both become subject matter simultaneously.***"
"Claude_Monet","Claude Monet_1890_Haystacks, Midday.jpg","Haystacks, Midday","1890","Claude Monet","1840–1926","Oil on canvas","**Monet** began the systematic *Haystacks* series in the autumn of 1890, when he arranged with his neighbor Monsieur Quéruel for continuous access to the grainstacks that stood in fields near his house at *Giverny*. This canvas, painted in the high, flat light of midday, captures the stacks as solid, almost lunar forms against a blue sky — ***the Impressionist revelation that noon light can be as revealing as dawn or dusk***. His stepdaughter Blanche Hoschedé accompanied him to the fields each morning with a wheelbarrow carrying up to a dozen canvases, which **Monet** would rotate as the light changed throughout the day. The *National Gallery of Australia* in *Canberra* holds this canvas (W1271)."
"Claude_Monet","Claude Monet_1900_Water Lily Pond, Pink Harmony.jpg","Water Lily Pond, Pink Harmony","1900","Claude Monet","1840–1926","Oil on canvas","**Monet** built his famous water garden at *Giverny* in 1893 by purchasing a water meadow and redirecting a local stream to fill an ornamental pond planted with white and imported South American water lilies. This early view of the pond dates from 1900, when he first exhibited a group of Water Lily paintings at the *Galerie Durand-Ruel*, focusing primarily on the Japanese wooden bridge that arched over the pond's narrowest point. The pink-harmony palette reflects the imported cultivars from Egypt and South America that produced lilies ranging from white through pink to yellow. Now in the *Musée d'Orsay*, it belongs to the group that critics praised as reaching ***'the ultimate degree of abstraction and imagination joined to the real.'***"
"Claude_Monet","Claude Monet_1879-1880_Apples and Grapes.jpg","Apples and Grapes","1879-1880","Claude Monet","1840–1926","Oil on canvas","**Monet** turned to still-life painting during the *Vétheuil* years partly out of domestic circumstance — winter weather confining him indoors — and partly from a need to exercise his eye on controlled arrangements of color and form after the emotional devastation of Camille's death in 1879. This arrangement of apples and grapes combines the tradition of French kitchen still-life with **Monet**'s characteristic attention to the way ambient light transforms local color; the fruit is not so much described as ***illuminated from within by color sensations***. These *Vétheuil*-period still lifes are markedly different in mood from the sunlit *Argenteuil* period; a gravity of touch replaces the earlier spontaneity. The canvas anticipates *Cézanne*'s near-contemporary studies of fruit as geometric form, though **Monet**'s aim is always atmospheric rather than structural."
"Claude_Monet","Claude Monet_1876_The Parc Monceau.jpg","The Parc Monceau","1876","Claude Monet","1840–1926","Oil on canvas","**Monet** painted three views of the fashionable *Parc Monceau* in the wealthy 8th arrondissement of Paris in 1876, exploring the dappled light filtering through chestnut trees as bourgeois Parisians strolled the graveled paths. These paintings belong to his commitment during the Argenteuil years to depicting the modern leisure life of the urban and suburban middle class — parks, promenades, regattas, and garden parties. This view captures ***the luminous green-gold atmospheric effect of sunlight through a tree canopy***, one of the most difficult challenges in plein-air painting, resolved here through **Monet**'s characteristic short strokes and suppression of black. The *Parc Monceau* canvases are now in the *Metropolitan Museum of Art* in New York and other international collections."
"Claude_Monet","Claude Monet_1873_The Sheltered Path.jpg","The Sheltered Path","1873","Claude Monet","1840–1926","Oil on canvas","**Monet** painted several views of shaded garden paths during the early *Argenteuil* years, combining his passion for horticulture with his painterly investigation of how foliage filters and fragments sunlight into ***a shifting mosaic of warm and cool tones***. This sheltered path, possibly in the garden of his rented house at *Argenteuil* where he planted gladioli and created what he called the 'single most important' motif of his final Argenteuil years, is rendered in rapid notations of green and gold. **Renoir** frequently painted alongside **Monet** at *Argenteuil* at this date, and the two friends sharpened each other's technique in the sustained plein-air collaboration that is central to Impressionism's emergence. The loosely brushed foliage and sun-dappled ground are among the period's finest achievements."
"Claude_Monet","Claude Monet_1880_Island of Flowers near Vétheuil.jpg","Island of Flowers near Vétheuil","1880","Claude Monet","1840–1926","Oil on canvas","**Monet** discovered a small island in the Seine near *Vétheuil* whose summer flowering transformed it into an unlikely paradise of wild flowers, and he painted it in several versions as a respite from the bleak winter and ice-thaw pictures that dominate his *Vétheuil* output. This view shows the island in full summer color, ***the brilliant wildflower masses mirrored in the still, glassy water*** of the river arm that surrounds it — a lyrical counterpoint to the frozen desolation of the 1880 ice break-up paintings. The *Vétheuil* flower paintings demonstrate that **Monet**'s eye for natural abundance was never dulled by personal grief; Camille had died the previous year. These canvases were sold successfully to collectors through **Monet**'s dealings with *Paul Durand-Ruel*."
"Claude_Monet","Claude Monet_1877_Arrival of the Normandy Train, Gare Saint-Lazare.jpg","Arrival of the Normandy Train, Gare Saint-Lazare","1877","Claude Monet","1840–1926","Oil on canvas","**Monet** painted twelve canvases of the *Gare Saint-Lazare* between January and April 1877, gaining special permission from the director of the Compagnie des Chemins de fer de l'Ouest to work from the station concourse. He is reported to have intimidated railway officials into holding engines with steam up so he could study the billowing vapor at its most dramatically atmospheric. This canvas — now in the *Art Institute of Chicago* — depicts the arrival of the *Normandy* train, capturing the moment when locomotive steam ***dissolves the iron-and-glass shed into a ***shimmering, gaseous veil of modernité***. Seven of the twelve paintings were shown at the Third Impressionist Exhibition in 1877 where critics praised them as a revelation of industrial sublimity."
"Claude_Monet","Claude Monet_1884_Palm Trees at Bordighera.jpg","Palm Trees at Bordighera","1884","Claude Monet","1840–1926","Oil on canvas","**Monet** spent February to April 1884 at *Bordighera* on the *Italian Riviera*, lured partly by the exotic vegetation he had never encountered in Normandy. He found the palm trees 'exasperating' to render — writing to Alice that 'these palm trees are maddening; everything is so lush' — yet the resulting canvases are among the most joyous of his career. This view of sun-struck palm fronds against the blue Mediterranean sky required **Monet** to develop new combinations of yellow-green and cerulean blue that went beyond anything his Normandy palette had demanded. The *Bordighera* palms appealed to the growing Impressionist market for bright, southern-lit canvases, and the series sold well through *Durand-Ruel's* galleries."
"Claude_Monet","Claude Monet_1889_The Grande Creuse by the Bridge at Vervy.jpg","The Grande Creuse by the Bridge at Vervy","1889","Claude Monet","1840–1926","Oil on canvas","**Monet** was deeply moved by the stark beauty of the *Creuse valley* in central France, which he described as 'sombre and gloomy' — a landscape of ancient granite and wild oak that offered a complete contrast to the gentle Seine river country he had worked for fifteen years. The bridge at *Vervy* appears in this canvas as a modest stone arch spanning the fast-running *Grande Creuse*, framed by bare hillsides still waiting for spring. The series was exhibited at the *Galerie Georges Petit* in June 1889 alongside sculpture by *Auguste Rodin*, and critics recognized the *Creuse* paintings as marking ***a new seriousness in Monet's engagement with landscape's elemental forces***. He was back in *Giverny* by May but would not revisit the valley."
"Claude_Monet","Claude Monet_1882_Customhouse, Varengeville.jpg","Customhouse, Varengeville","1882","Claude Monet","1840–1926","Oil on canvas","**Monet** made three separate painting campaigns to the *Normandy* cliff-top village of *Varengeville* in 1882 and again in 1896-97, captivated by the old fisherman's church of Saint-Valéry overlooking the sea and the dramatic customs-post buildings on the clifftops. This view of the former customhouse — a functional stone building typical of the *Norman* coast — sets the solid architecture against a clifftop panorama of ***sea, sky, and eroding chalk headland***. The 1882 campaign yielded a group of pictures that **Monet** later described as capturing a quality of misty, oceanic light unique to this stretch of the *Channel* coast. The canvas demonstrates his ability to find pictorial grandeur in modest vernacular architecture."
"Claude_Monet","Claude Monet_1878_Island of La Grande Jatte Through the Trees.jpg","Island of La Grande Jatte Through the Trees","1878","Claude Monet","1840–1926","Oil on canvas","**Monet** painted a group of views of the *Island of La Grande Jatte* in the Seine west of Paris in 1878 — the same island that *Georges Seurat* would transform into a monument of Post-Impressionism seven years later with his *Grande Jatte* painting of 1884-86. **Monet**'s version has nothing of Seurat's frozen formalism; instead the island appears through a screen of riverside trees in full summer foliage, the dappled light creating ***a trembling, animate green world in which the Seine flickers through the branches***. The views belong to the period when **Monet** was living in *Paris* during difficulties over his *Argenteuil* lease. They are among the most intimate and joyous of his 1878 canvases."
"Claude_Monet","Claude Monet_1907_Still Life with Eggs.jpg","Still Life with Eggs","1907","Claude Monet","1840–1926","Oil on canvas","**Monet** painted very few still lifes after the 1880s — his artistic energies from the 1890s onward were absorbed by the great series projects — making this 1907 canvas an anomaly in his late production. The arrangement of eggs on a simple surface is handled with a spare elegance that recalls *Chardin* while the color temperature of the ambient light clearly belongs to **Monet**'s mature practice; ***the eggshells become vehicles for an investigation of reflected light as complex as any water lily surface***. The date also suggests the canvas may have been a demonstration piece or study rather than a primary exhibition work. It exemplifies his belief that any subject — however humble — could become the ground for luminous perception."
