"artwork_dir","artwork_file","artwork_title","artwork_year","artist_name","artist_lifespan","artwork_medium","artwork_description"
"Claude_Monet","Claude Monet_1881_Cliff at Fecamp.jpg","Cliff at Fecamp","1881","Claude Monet","1840–1926","Oil on canvas","The chalk cliffs at *Fécamp* extend in both directions from the town on the *Haute-Normandie* coast, providing **Monet** with dramatic vertical walls of pale stone that he painted from below on the beach or from the clifftop looking across to the next headland. This 1881 cliff view belongs to his first sustained *Fécamp* campaign and shows the face of the cliff in the particular quality of late-winter or early-spring light that strikes the chalk at an acute angle and reveals every crevice and fossil layer. ***The layered geological record of the chalk cliff face provides a kind of physical evidence of deep time*** that may have appealed to **Monet**'s increasingly panoramic temporal consciousness. The *Fécamp* cliff views were sold through *Durand-Ruel*'s Paris gallery."
"Claude_Monet","Claude Monet_1875_Snow in Argenteuil.jpg","Snow in Argenteuil","1875","Claude Monet","1840–1926","Oil on canvas","This *Argenteuil* snow view of 1875 offers a panoramic perspective of the town under a blanket of winter snow — the rooftops and garden walls creating a pattern of white rectangles broken by dark chimneys and bare trees. **Monet** was fascinated throughout his career by the way snow ***transforms the familiar into the unfamiliar***, stripping color from a known world and imposing tonal relationships that persist for days or weeks before disappearing again. These broad snow views from *Argenteuil* are among the most survey-like of his winter paintings — less intimate than the street views, more concerned with the overall pattern of a snow-covered town seen from above or from a slight distance. The *Hermitage Museum* in *St. Petersburg* holds an important *Argenteuil* winter view."
"Claude_Monet","Claude Monet_1870_Camille on the Beach in Trouville.jpg","Camille on the Beach in Trouville","1870","Claude Monet","1840–1926","Oil on canvas","**Monet** painted several views of Camille — the woman who had been his model, companion, and finally wife since 1865 — on the fashionable *Trouville* beach in the summer of 1870, their last summer together before the war. This canvas shows her seated in a beach chair against the white-gold expanse of the *Norman* beach, a figure observed with the particular combination of ***formal pictorial engagement and intimate knowledge*** that distinguishes **Monet**'s images of his wife from his other figure work. Camille died nine years later at *Vétheuil*; these 1870 *Trouville* portraits carry the quality of happiness preserved in paint. Some of the 1870 *Trouville* canvases are confirmed to contain actual grains of beach sand embedded in the paint surface."
"Claude_Monet","Claude Monet_1864_The Seashore at Sainte-Adresse.jpg","The Seashore at Sainte-Adresse","1864","Claude Monet","1840–1926","Oil on canvas","This early seashore view, painted near the *Le Havre* suburb of *Sainte-Adresse* where **Monet** spent summers with his family, belongs to the very beginning of his independent career and shows the formative influence of *Boudin* and *Jongkind* absorbed and beginning to be personalized. The beach subject — with its expanse of pale sand, the horizontal sea, and the large sky — provided the coastal grammar that **Monet** would refine over six subsequent decades. ***The directness of the young Monet's observation — his refusal of pictorial convention even at age twenty-three*** — is already evident in the fresh, unaffected handling of the beach sand and shallow water. These early *Sainte-Adresse* paintings were the foundation on which all the later coastal greatness was built."
"Claude_Monet","Claude Monet_1897_Steep Cliffs near Dieppe.jpg","Steep Cliffs near Dieppe","1897","Claude Monet","1840–1926","Oil on canvas","**Monet**'s 1896-97 *Normandy* coastal campaign produced a group of these severe, near-vertical cliff views near *Dieppe* that are among the most austere in his entire seascape oeuvre. The chalk cliffs near *Dieppe* rise especially steeply from a very narrow beach, creating a compositional situation in which cliff face and sky occupy the entire canvas with no foreground transition — ***the frontal geological wall confronting the viewer with the directness of a close-up portrait***. **Monet** worked from the clifftop looking down, from the beach looking up, and from the sea looking in — producing a full survey of each site's pictorial possibilities. These late *Dieppe* cliff studies are prized by collectors for their unusual combination of compositional severity and chromatic sensitivity."
"Claude_Monet","Claude Monet_1882_Church at Varengeville, Morning Effect.jpg","Church at Varengeville, Morning Effect","1882","Claude Monet","1840–1926","Oil on canvas","This morning-light version of the *Varengeville* church subject captures the clifftop *Saint-Valéry* church in the cool, early-morning light that is the most neutrally revealing of the four major lighting conditions — morning, noon, sunset, and grey weather — that **Monet** documented during his 1882 campaign. The morning version has a particular freshness and clarity absent in the warmer sunset versions; ***the church appears most solidly itself in this flat morning light***, before the sun's movement begins transforming its surfaces. The *Varengeville* morning canvases were made earliest in the day during **Monet**'s extended *Normandy* coast sessions, the painter working through the day and rotating to different subjects as the light changed. The *J. Paul Getty Museum* in *Los Angeles* holds a painting from the 1882 *Varengeville* campaign."
"Claude_Monet","Claude Monet_1882_Edge of the Cliff at Pourville 01.jpg","Edge of the Cliff at Pourville 01","1882","Claude Monet","1840–1926","Oil on canvas","**Monet** returned repeatedly to the clifftop edge at *Pourville* during his 1882 campaign, fascinated by the narrow strip of land at the cliff's brink where the *Norman* agricultural plateau terminates abruptly above the *Channel*. Standing at the cliff edge and painting the sea from above creates a ***vertiginous, horizon-dominated view*** in which the ocean fills the lower half of the canvas and only a thin strip of eroding chalk clifftop occupies the foreground. The slight irregularity of the cliff edge — grass and chalk giving way in soft curves to the sea — creates a compositional transition between foreground and sky that **Monet** solved differently in each of the multiple versions from this campaign. The *Art Institute of Chicago* holds his celebrated *Cliff Walk at Pourville* from this same campaign."
"Claude_Monet","Claude Monet_1882_Edge of the Cliff at Pourville 02.jpg","Edge of the Cliff at Pourville 02","1882","Claude Monet","1840–1926","Oil on canvas","This second clifftop view from the 1882 *Pourville* campaign approaches the edge from a slightly different position or in a different atmospheric condition from the companion canvas — the slight shift in position or light creating a markedly different color temperature and spatial arrangement. Together, the two *Edge of the Cliff* canvases from *Pourville* demonstrate ***the precision with which **Monet** controlled variation within a series***, using small positional differences to arrive at genuinely distinct chromatic solutions. The vertical drama of the open-sea view from the clifftop edge was among his most admired compositions; the cliff-edge views from *Pourville* and *Varengeville* helped establish his *Norman* coast campaigns as pivotal in the history of atmospheric landscape."
"Claude_Monet","Claude Monet_1870_Road at Louveciennes, Melting Snow, Sunset.jpg","Road at Louveciennes, Melting Snow, Sunset","1870","Claude Monet","1840–1926","Oil on canvas","**Monet** was living at *Louveciennes* on the *Seine* southwest of *Paris* in early 1870, in the same village where *Camille Pissarro* had been based and where *Alfred Sisley* was also working. The melting-snow condition of this road view — with the snow reducing to grey slush in the light of a dim winter sunset — creates ***one of the most transient of all the seasonal conditions **Monet** painted***: the moment between the hard permanence of snow and the complete return of bare earth. The warm-cold opposition of the sunset glow against the grey slush anticipates the chromatic concerns he would pursue in the late *Argenteuil* snow-and-sunset pictures of 1875. **Monet** left *Louveciennes* in June 1870 when the Franco-Prussian War began."
"Claude_Monet","Claude Monet_1889_Study of Rocks.jpg","Study of Rocks","1889","Claude Monet","1840–1926","Watercolor on paper","**Monet** used watercolor rarely — he was fundamentally an oil painter — but during the *Creuse valley* campaign of 1889 he made a small group of watercolor studies of the valley's granite formations, using the medium's transparency to capture the wet, glowing quality of freshly rain-washed rock. This watercolor study, with its wet washes of grey-blue and ochre, demonstrates ***a technical control of watercolor that is entirely consistent with his oil technique — rapid, decisive, and intimately accurate*** about how light behaves on a specific geological surface. The rarity of **Monet**'s watercolors makes this *Creuse* study particularly valuable as a document of his wider graphic practice. Watercolor studies from his campaigns are in the collections of the *Musée Marmottan Monet* and several American institutions."
"Claude_Monet","Claude Monet_1886_Rocks at Port-Goulphar, Belle-Ile.jpg","Rocks at Port-Goulphar, Belle-Ile","1886","Claude Monet","1840–1926","Oil on canvas","This second view of the *Port-Goulphar* rocks at *Belle-Île* — close in subject to its companion canvas but approached from a different angle or in a different light — extends **Monet**'s systematic examination of the basalt formations on the island's south coast. Where the companion view may emphasize the vertical isolation of the stacks, this version places greater emphasis on the way ***stormy sea water surges through the channels between the rocks***, the white foam creating an irregular pattern of highlights against the dark coastal stone. These double-rock views from *Port-Goulphar* demonstrate that even in the most challenging conditions, **Monet** was working in the serial mode that defined his entire oeuvre. The companion canvases from *Belle-Île* are now in *American*, *Russian*, and *French* collections."
"Claude_Monet","Claude Monet_1908_San Giorgio Maggiore.jpg","San Giorgio Maggiore","1908","Claude Monet","1840–1926","Oil on canvas","**Monet** painted the island church of *San Giorgio Maggiore* from multiple positions across the *Venetian* lagoon, finding in the white *Palladian* facade and the slender bell tower a silhouette that transformed under different lighting conditions from brilliant architectural precision to ***pure luminous apparition***. This view — approaching the church as its own subject without the *Doge's Palace* across the water — shows the Palladian structure in the full light that renders the white stone almost incandescent against the blue of the *Adriatic* sky and the pale lagoon water. **Monet** later stated that *Venice* was 'too beautiful to paint' — meaning that its beauty was too conventional, too pre-known to allow fresh seeing — but the *San Giorgio Maggiore* canvases prove otherwise."
"Claude_Monet","Claude Monet_1882_Path at Varengeville.jpg","Path at Varengeville","1882","Claude Monet","1840–1926","Oil on canvas","The cliff path at *Varengeville* connecting the clifftop church to the beach below runs through a landscape of windswept scrub, chalk outcroppings, and seasonal wildflower meadows that provided **Monet** with a pathway as a compositional device — a diagonal recession leading the eye from the clifftop toward the sea vista below. The path-as-subject organizes the variable details of clifftop vegetation into a ***directed spatial narrative moving from above to below, from grass to sea*** in a unified descent. These path views from the 1882 *Varengeville* campaign complement the more static cliff-face and church views, adding a spatial dynamism to the series. They were among the first of his *Normandy* paintings to attract significant collector interest."
"Claude_Monet","Claude Monet_1897_Chrysanthemums 01.jpg","Chrysanthemums 01","1897","Claude Monet","1840–1926","Oil on canvas","**Monet** painted two groups of chrysanthemum studies at *Giverny* in 1897, using the late-autumn flower — still prominent in the garden through October and into November — as a subject that allowed him to work outdoors after the Water Lily pond had become too cold for morning sessions. The 1897 chrysanthemum canvases are larger and more directly observed from the garden than the earlier *Vétheuil* studio still lifes, and the blooms are rendered in a dense, near-mosaic technique that ***fills the canvas with an all-over pattern of petals in yellow, orange, and white*** against the dark background of late autumn foliage. These late-season garden paintings bridge the gap between the summer Water Lily campaigns and the winter studio periods."
"Claude_Monet","Claude Monet_1897_Chrysanthemums 02.jpg","Chrysanthemums 02","1897","Claude Monet","1840–1926","Oil on canvas","This second chrysanthemum canvas from 1897 approaches the same subject — the *Giverny* autumn chrysanthemum beds — from a different vantage or in a different chromatic condition from the first, the color balance shifting toward more orange and less yellow in a variation that demonstrates **Monet**'s consistent practice of serial observation within a single painting campaign. The 1897 chrysanthemum pair belongs to an informal series of garden subjects — irises, day lilies, wisteria, roses — that **Monet** pursued alongside the water garden paintings throughout the *Giverny* decades. ***Each pair of companion canvases tests the stability of color observation across subtle variations in condition*** — the same intellectual procedure that governed the formal series paintings."
"Claude_Monet","Claude Monet_1881_The Beach at Fecamp.jpg","The Beach at Fecamp","1881","Claude Monet","1840–1926","Oil on canvas","The pebble beach at *Fécamp* — positioned at the foot of the chalk cliffs between the harbor and the open *Channel* — provided **Monet** with a coastal subject that combined the vertical drama of the cliff face with the horizontal sweep of the beach. This view shows the beach looking along the shingle under a grey or partly cloudy sky, the chalky pebbles absorbing and reflecting the diffuse overhead light in a muted, ***tonally complex surface that challenges the painter to discover variety within apparent monotony***. **Monet** found in the *Fécamp* beach a subject less picturesque than *Étretat* but in some ways more demanding — there is no ready-made compositional drama in a plain pebble beach, only the quality of light. These *Fécamp* beach studies circulate primarily in private collections."
"Claude_Monet","Claude Monet_1886_Tulip Field in Holland.jpg","Tulip Field in Holland","1886","Claude Monet","1840–1926","Oil on canvas","**Monet**'s *Holland* tulip campaign of April-May 1886 produced a group of field views that exploit the uniquely artificial landscape of the *South Holland* polder — completely flat, precisely cultivated in parallel bands of pure color, and proportioned by the windmills that appear on the horizon line. This tulip field view shows the horizontal stripes of red, yellow, and pink flowers stretching to the horizon with ***the decorative clarity of a *Japanese* print translated into oil paint***. The Dutch bulb industry had by 1886 developed cultivars of extraordinary color purity unavailable in *French* gardens, and **Monet** traveled to the *Netherlands* specifically to document this horticultural phenomenon. The *Art Institute of Chicago*, the *Van Gogh Museum*, and private collections hold canvases from this campaign."
"Claude_Monet","Claude Monet_1868_On the Bank of the Seine, Bennecourt.jpg","On the Bank of the Seine, Bennecourt","1868","Claude Monet","1840–1926","Oil on canvas","**Monet** painted this relaxed riverside scene in the summer of 1868 while staying at *Bennecourt* on the *Seine* with Camille and their infant son Jean. The figure — likely Camille — sits on the riverbank looking across to the village of *Bonnières* on the far shore, the boat moored at the bank beside her suggesting the domestic river life **Monet** would formalize with his studio boat three years later at *Argenteuil*. The scene exemplifies everything the young **Monet** found beautiful: ***a woman idly watching the light on the river, the village of ordinary life on the far bank, the quiet scene rendered not as genre subject but as atmospheric event***. The *Art Institute of Chicago* holds this early masterpiece."
"Claude_Monet","Claude Monet_1885_Road near Giverny.jpg","Road near Giverny","1885","Claude Monet","1840–1926","Oil on canvas","**Monet** painted the roads traversing the *Giverny* plateau — the limestone hills above the village that separate the *Seine* and *Epte* valleys — in a group of views that combine the familiar *Normandy* road-in-landscape subject with the specific topography of his new home. The *Giverny* plateau roads in summer are lined with grasses and low hedges that frame the view toward the distant valley hills, creating compositions of ***open, wind-scoured Norman farmland that provides a complete chromatic contrast to the enclosed, water-saturated world of the lily pond***. These road views from 1885 belong to his first two years at *Giverny* when he was still discovering the local landscape in its full seasonal range. The *Museum of Fine Arts, Boston* holds a related *Giverny* road view."
"Claude_Monet","Claude Monet_1881_The Spring at Vetheuil.jpg","The Spring at Vetheuil","1881","Claude Monet","1840–1926","Oil on canvas","In the final year of his *Vétheuil* residency **Monet** painted the arrival of spring — the return of green to the *Seine* valley hillsides after one of its hardest winters — with the intensity of a man for whom the season meant genuine renewal after years of grief and economic difficulty. This spring view captures the pale, fresh greens of new growth on the valley sides above the river, the ***delicate renewal of color after the grey-white desolation of the ice-break winter*** radiating an almost physical relief. The *Spring at Vétheuil* belongs to the group that shows **Monet** leaving on a note of seasonal recovery — the village that witnessed his most harrowing years also witnessed this renewal. He left *Vétheuil* in late 1881."
"Claude_Monet","Claude Monet_1866_Jar of Peaches.jpg","Jar of Peaches","1866","Claude Monet","1840–1926","Oil on canvas","**Monet** painted a group of still lifes in the mid-1860s — jars of preserves, fruit arrangements, and decorative objects — as studio exercises completed between his ambitious Salon-scale figure and landscape paintings. This view of preserved peaches in a glass jar exploits the transparency of the glass and the warmth of the preserved fruit to create an ***intimate study of how light passes through and is modified by translucent containers***, a problem of optics that he found consistently compelling. The 1866 date places this among his earliest surviving still lifes, made in the same year as the ambitious *Garden at Sainte-Adresse* and *Women in the Garden*. The jar of peaches demonstrates that his still-life intelligence was in place while he was still in his mid-twenties."
"Claude_Monet","Claude Monet_1886_Floods at Giverny.jpg","Floods at Giverny","1886","Claude Monet","1840–1926","Oil on canvas","The periodic flooding of the *Epte* river that swept over the *Giverny* meadows in late winter or early spring transformed the familiar fields into shallow inland seas from which trees and farmhouses emerged at the water's edge. **Monet** painted several views of these *Giverny* floods, finding in them an expanded version of the reflective water surfaces he had been studying at *Argenteuil* and *Vétheuil*. ***The flooded meadow creates a vast, still mirror of the pale winter sky*** in which trees stand isolated as dark vertical forms — an extraordinarily simple subject that requires the most refined chromatic sensitivity. The *floods* paintings of 1886 belong to his first years at *Giverny* and foreshadow the water-garden world he would create seven years later."
"Claude_Monet","Claude Monet_1901_Vétheuil, Sunset.jpg","Vétheuil, Sunset","1901","Claude Monet","1840–1926","Oil on canvas","**Monet** returned to paint *Vétheuil* from the river in 1901, bringing to the familiar view — the church tower, the village houses, the wooded hillside — a palette and technique transformed by two decades of further development. This sunset version bathed the old subject in the warm, diffuse light of early evening, the church and houses dissolving in the reflective water of the *Seine* into ***golden-orange masses barely distinct from their mirror images below***. The 1901 revisit was made from a studio boat, the same kind of vessel he had used at *Argenteuil* in the 1870s; these late *Vétheuil* views combine the retrospective authority of a painter returning to an important subject with the full technical resources of his mature period. The *Musée des Beaux-Arts* in *Lyon* holds an important related canvas."
"Claude_Monet","Claude Monet_1873_The Seine at Asnieres.jpg","The Seine at Asnieres","1873","Claude Monet","1840–1926","Oil on canvas","**Monet** painted the *Seine* at *Asnières* — the industrial suburb northwest of *Paris* that *Seurat* would memorialize twelve years later in his *Grande Jatte* period — as part of his wider exploration of the Paris-region river network during the *Argenteuil* years. The *Asnières* reach of the *Seine*, with its combined industrial and leisure character, offered a different visual vocabulary from the purer countryside of *Argenteuil* downstream — more chimneys, more commercial traffic, more of the ***ambiguity of a river serving simultaneously as industrial artery and weekend playground***. **Monet**'s 1873 *Asnières* view is exceptional in his work for engaging with the more industrialized stretch of the river. The *National Museum of Wales* in *Cardiff* holds an important canvas from this date."
"Claude_Monet","Claude Monet_1899_Skaters at Giverny.jpg","Skaters at Giverny","1899","Claude Monet","1840–1926","Oil on canvas","In the winter of 1899 an unusually sustained cold spell froze the ponds and the river arms near *Giverny*, and **Monet** painted the local children and villagers skating on the ice in a group of rare winter-figure compositions. These skating views are exceptional in his late production for including moving figures observed at speed — the skaters rendered as rapid, gestural notations of color against the ice — and they have the freshness of ***plein-air direct observation under cold, bright conditions*** that he associated with his earliest Normandy paintings. The *Giverny* skating canvases of 1899 are among the most intimate and least-known of his late works, and they connect the enclosed private world of the garden to the wider communal world of the village. They were never formally exhibited as a series."
"Claude_Monet","Claude Monet_1886_The Coast at Port d'Amont, Rough Sea.jpg","The Coast at Port d'Amont, Rough Sea","1886","Claude Monet","1840–1926","Oil on canvas","The *Port d'Amont* headland on *Belle-Île*'s exposed south coast appears in this rough-sea view as dark, monumental rock rising from a churning Atlantic swell — a subject as far removed from the gentle Seine river scenes as **Monet** had ever ventured. By autumn 1886, after six weeks on the island, ***he had developed a new chromatic vocabulary for painting volcanic rock in heavy weather***: deep purple-black for the rock, a bruised grey-green for the rising swells, and pure white for the foam where sea met stone. The rough-sea *Belle-Île* canvases were the most popular of the 1887 *Galerie Georges Petit* exhibition where the group was first shown. The transition in chromatic ambition between the *Étretat* chalk canvases of 1885 and these *Belle-Île* basalt views of 1886 marks one of the decisive developments in **Monet**'s mature style."
"Claude_Monet","Claude Monet_1873_Port d'Amont, Étretat.jpg","Port d'Amont, Étretat","1873","Claude Monet","1840–1926","Oil on canvas","**Monet** made earlier visits to *Étretat* in the 1860s and early 1870s, well before the celebrated 1880s campaigns that produced his most famous cliff canvases. This 1873 view of the *Port d'Amont* headland at *Étretat* — the eastern cliff with its arch — is an early study of the site that anticipates the fuller treatment he would give the western *Porte d'Aval* in later years. ***The geological familiarity with the site demonstrated in this early view underpins the confidence of the 1883-86 masterworks*** — **Monet** had been observing these cliffs for a decade before he made his concentrated campaigns. The 1873 *Port d'Amont* canvas is a significant document of the long preparation behind his most celebrated achievements."
