"artwork_dir","artwork_file","artwork_title","artwork_year","artist_name","artist_lifespan","artwork_medium","artwork_description"
"Claude_Monet","Claude Monet_1882_The Cliff Walk at Pourville.jpg","The Cliff Walk at Pourville","1882","Claude Monet","1840–1926","Oil on canvas","**Monet** spent the winter and spring of 1882 at *Pourville*, a small village near *Dieppe* on the *Norman* coast, where he rented a fisherman's cottage and painted the clifftops and sea in almost daily sessions. This view of the cliff walk — showing two female figures on the windswept path above the *Channel* with the unbroken sea horizon below — is among his most beloved compositions of the period. The figures, likely Alice Hoschedé and her daughter Germaine, are rendered without facial detail; they function not as portraits but as ***scale indicators that measure the immensity of cliff and sea against the fragility of human presence***. The *Art Institute of Chicago* holds this celebrated canvas."
"Claude_Monet","Claude Monet_1878-1879_The Church at Vetheuil under Snow.jpg","The Church at Vetheuil under Snow","1878-1879","Claude Monet","1840–1926","Oil on canvas","**Monet** painted the *Vétheuil* church under the first heavy snowfalls of the winter of 1878-79, building a record of the village in seasonal transformation that parallels his later series projects in its systematic nature. The white bulk of fresh snow on the church roof and the surrounding buildings creates ***the same flattening of form that **Hiroshige**'s woodblock snow scenes achieve***, and it is likely that **Monet**'s Japanese print collection — already substantial by this date — influenced his approach to winter subjects. The cold palette of these snow views is among the most sustained in his oeuvre; black has been entirely suppressed even in the shadow regions. The *Musée d'Orsay* and *Philadelphia Museum of Art* hold fine examples."
"Claude_Monet","Claude Monet_1891_Grainstack (Sunset).jpg","Grainstack (Sunset)","1891","Claude Monet","1840–1926","Oil on canvas","This sunset version from the *Haystacks* series, now in the *Museum of Fine Arts, Boston* (W1289), is among the most theatrical of the entire group — the single remaining stack silhouetted against a sky of orange, pink, and deep violet as the sun touches the horizon. **Monet** worked from a prepared series of canvases, rotating through them as the light changed, so this canvas may have received final touches on only fifteen minutes of observation per session. ***The drama of the sunset transforms the quotidian agricultural object into something approaching the sublime*** — precisely the paradox that makes the *Haystacks* series enduringly compelling. When the *Haystacks* were later exhibited in *Russia* and seen by *Wassily Kandinsky*, he reported that the painting had 'unsuspected power' that revealed to him the independent force of color."
"Claude_Monet","Claude Monet_1880_Still Life with Pears and Grapes.jpg","Still Life with Pears and Grapes","1880","Claude Monet","1840–1926","Oil on canvas","**Monet**'s *Vétheuil*-period still lifes — painted in the winters when coastal campaigns were impossible — are characterized by a deliberate economy of means and a preference for the cool, clear light of the north-facing studio over the warmth of the earlier *Argenteuil* fruit paintings. This arrangement of pears and grapes uses the dark, round forms of the fruit to study ***how light rakes across curved surfaces and creates the illusion of weight and volume almost entirely through tonal modulation***. The *1880* date places this canvas in the productive winter between Camille's death and **Monet**'s submission to the Salon — a period of institutional re-engagement with the mainstream of French art history. The still lifes of this year reveal a painter exercising control after emotional tumult."
"Claude_Monet","Claude Monet_1882_Port of Dieppe, Evening.jpg","Port of Dieppe, Evening","1882","Claude Monet","1840–1926","Oil on canvas","**Monet** visited *Dieppe* in the early 1880s as part of his sustained campaign along the *Norman* coast, painting the working harbor alongside the cliff landscapes that are more typically associated with his Norman period. The evening light in this harbor view — the last colors of day reflected in the harbor water between commercial vessels — demonstrates ***his lifelong interest in the specific color of ambient light at transitional moments of the day***. Port scenes from *Dieppe*, *Honfleur*, and *Étretat* run throughout his career from the early 1860s onward, connecting him to the seventeenth-century Dutch marine tradition and to the coastal paintings of his mentor *Eugène Boudin*. This canvas was made during the same 1882 campaign that produced the celebrated *Falaise* and *Varengeville* cliffscapes."
"Claude_Monet","Claude Monet_1897_The Seine at Giverny.jpg","The Seine at Giverny","1897","Claude Monet","1840–1926","Oil on canvas","**Monet** regularly painted the *Seine* between *Vernon* and *Port-Villez*, the section of the river that lay within easy reach of *Giverny*, in the 1890s — particularly the narrow tributary arms and backwaters where willows trailed their branches into nearly still water. This 1897 view is made in the same summer as the *Morning on the Seine* series, and shares that series' interest in ***the precise color gradations of reflected foliage and sky that the river surface offers when conditions are undisturbed***. The overhanging willows create a canopy that frames rather than opens the composition, producing a world enclosed within color rather than framed by horizon. These intimate views of the local *Seine* differ fundamentally in mood from the open-river *Argenteuil* canvases of two decades earlier."
"Claude_Monet","Claude Monet_1875_Snow Effect with Setting Sun.jpg","Snow Effect with Setting Sun","1875","Claude Monet","1840–1926","Oil on canvas","**Monet**'s winter paintings at *Argenteuil* include a number of canvases that combine two of the most difficult subjects in plein-air painting — snow and sunset — into a single chromatic challenge. This canvas renders the extraordinary warmth of low winter sun on snow, which transforms the white surface into a mosaic of orange, pink, and lavender shadows — ***color that would have seemed exaggerated to contemporary viewers accustomed to the neutral greys of academic snow rendering***. Painted in 1875, the year after the first Impressionist exhibition, it demonstrates **Monet**'s increasing confidence in pursuing extreme chromatic effects regardless of their departure from conventional representation. The *Musée d'Orsay* holds an important related snow-effect canvas from *Argenteuil*."
"Claude_Monet","Claude Monet_1884_Olive Trees in the Moreno Garden.jpg","Olive Trees in the Moreno Garden","1884","Claude Monet","1840–1926","Oil on canvas","During his 1884 campaign at *Bordighera**, **Monet** was granted access to the garden of *Francesco Moreno*, a wealthy local resident whose terraced property commanded views over the sea and contained some of the most ancient and gnarled olive trees on the *Riviera*. The olive tree presented a pictorial challenge entirely different from the *Normandy* oak or the *Seine* willow: its silvery-green foliage catches light on both surfaces simultaneously, creating ***a shimmering, near-monochrome canopy that challenges the painter to find chromatic variety in near-monotone***. **Monet** produced multiple olive tree canvases in the *Moreno* garden, and found in them a subject as technically difficult as the haystacks or cathedral facades he would later pursue. The *Art Institute of Chicago* holds an important *Bordighera* olive tree painting."
"Claude_Monet","Claude Monet_1883_Cliff and Porte d'Aval by Stormy Weather.jpg","Cliff and Porte d'Aval by Stormy Weather","1883","Claude Monet","1840–1926","Oil on canvas","The *Porte d'Aval* — one of the great chalk arches at *Étretat* — rises from the sea at the western end of the beach and aligns, when viewed from below, with the famous Needle rock. **Monet** painted the arch in numerous weathers over multiple *Étretat* campaigns, and the stormy versions — like this 1883 canvas — are among the most physically immediate of his seascapes. ***The arch becomes a geological frame through which a tempestuous sea drives itself***, its chalk whiteness contrasting with the dark swelling Atlantic. He wrote to Durand-Ruel from *Étretat* in 1883: 'I am struggling with a series of different effects but at this time of year the sun sets so quickly that I can't keep up with it.' The composition directly influenced the *Normandy* coastal paintings of later decades."
"Claude_Monet","Claude Monet_1876_The Ball Shaped Tree, Argenteuil.jpg","The Ball Shaped Tree, Argenteuil","1876","Claude Monet","1840–1926","Oil on canvas","This unusual close-up view of a clipped, ball-shaped ornamental tree at *Argenteuil* represents **Monet**'s occasionally playful engagement with the oddities of the suburban garden landscape — the shaped tree a quintessentially French emblem of nature tamed by *Le Nôtre*-style formalism. The canvas approaches the tree from very close range, allowing its round form to dominate the composition and creating ***a nearly abstract study in green-on-green — the colour of shadow versus the colour of sunlit foliage***. **Monet** depicted the domestic garden of his *Argenteuil* house in several canvases from 1872-1876, treating the immediate surroundings of his home as a laboratory for observing how cultivated plants interact with natural light. These intimate garden views are prized among the early Impressionist canvases."
"Claude_Monet","Claude Monet_1904_Houses of Parliament, Effect of Sunlight in the Fog.jpg","Houses of Parliament, Effect of Sunlight in the Fog","1904","Claude Monet","1840–1926","Oil on canvas","**Monet** made three extended stays in *London* between 1899 and 1904, painting the *Houses of Parliament* from an upper floor of *St Thomas' Hospital* across the *Thames* from the *Westminster* bank. He worked on over sixty canvases of the *Houses of Parliament* subject but exhibited only a selection of nineteen at *Durand-Ruel* in 1904. This canvas captures the extraordinary moment when winter sunlight penetrates the river fog and strikes the *Victoria Tower* and *Clock Tower*, illuminating the *Gothic* architecture as a ***gold and purple apparition barely distinct from the saturated atmosphere that surrounds it***. The *Houses of Parliament* series was received as a revelation; the poet *Rainer Maria Rilke* called the paintings 'uncanny and strange, and so beautiful that I can hardly believe it'."
"Claude_Monet","Claude Monet_1894_Morning Haze.jpg","Morning Haze","1894","Claude Monet","1840–1926","Oil on canvas","This near-abstract canvas, in which the forms of trees and their reflections are dissolved into a grey-gold atmosphere of early morning mist, belongs to the group of dissolution studies **Monet** was pursuing between the *Rouen Cathedral* series of 1892-94 and the *Mornings on the Seine* series of 1896-97. The subject is essentially the condition of uncertainty at the boundary of visibility: ***morning haze performing on landscape the same work that cathedral stonework performs on architectural form*** — transforming the distinct into the atmospheric, the solid into the luminous. The date 1894 connects the canvas to the studio-reworking period of the *Cathedrals*, when **Monet** brought multiple series canvases back to *Giverny* for final harmonization. The *Wallraf-Richartz Museum* in *Cologne* holds a closely related haze study."
"Claude_Monet","Claude Monet_1869_The Bridge at Bougival.jpg","The Bridge at Bougival","1869","Claude Monet","1840–1926","Oil on canvas","**Monet** painted the *Seine* at *Bougival* — west of *Paris*, near *La Grenouillère* where he and *Renoir* were simultaneously working — in the late 1860s as part of his sustained investigation of river light during the period immediately preceding the launch of Impressionism. This view of the *Bougival* suspension bridge captures the structure spanning the *Seine* with the surrounding riverbank foliage of late summer, the blue water carrying broken reflections of bridge and sky. ***The bridge functions as a structural armature around which atmospheric light is organized*** — a compositional solution he would refine in the *Argenteuil* bridge series of the 1870s. The *Aichi Prefectural Museum of Art* in *Japan* holds a related *Bougival* bridge canvas."
"Claude_Monet","Claude Monet_1885_The Entrance to Giverny under the Snow.jpg","The Entrance to Giverny under the Snow","1885","Claude Monet","1840–1926","Oil on canvas","**Monet** painted the entrance road to *Giverny* under snow in 1885, two years after first renting the house that would become his permanent home. By this date he already regarded *Giverny* as the place uniquely responsive to his painterly needs, and the winter view of its approach — the road lined with houses and bare trees, under a heavy grey sky — shows ***the village as a private world closed against outside disturbance, awaiting spring***. The snow of the *Normandy* plateau is more stubborn than the Seine valley's, lying for weeks against the chalky hillsides, and these local winter views capture a more intimate, domestic winter than the exposed *Argenteuil* or *Vétheuil* ice paintings. The *Musée Marmotan Monet* holds related *Giverny* snow views."
"Claude_Monet","Claude Monet_1897_Val-Saint-Nicolas, near Dieppe (Morning).jpg","Val-Saint-Nicolas, near Dieppe (Morning)","1897","Claude Monet","1840–1926","Oil on canvas","**Monet** returned to the *Dieppe* area in 1896-97 after a long absence, painting the cliffs and coastal formations near *Puys* and *Varengeville* that he had last worked in the early and mid-1880s. *Val-Saint-Nicolas* is a narrow valley cutting through the chalk cliff to the sea near *Dieppe*, and this morning view captures the site in the cool grey-blue light of early day before the sun has warmed the atmosphere. The 1897 Normandy coastal canvases are among **Monet**'s subtlest; ***the grey light of the Channel coast requires a more intricate tonal sensitivity than the dramatic contrasts of southern subjects***, and the result is a group of paintings admired above all by other painters. These works were included in a major *Durand-Ruel* exhibition in 1898."
"Claude_Monet","Claude Monet_1875_Ladies in Flowers.jpg","Ladies in Flowers","1875","Claude Monet","1840–1926","Oil on canvas","This garden view of female figures among flowering plants belongs to a group of decorative *Argenteuil* garden paintings from 1875 that combine **Monet**'s interest in cultivated flowers with his ongoing engagement with figures in outdoor light. The women — likely Camille and a companion — are rendered with less facial individuality than in his earlier figure paintings; they exist primarily as ***arrangements of colored cloth and shade that interact with the surrounding floral chromatics***. These paintings have been compared to the decorative works his contemporary *Renoir* was making in the same years, though **Monet**'s approach is more insistently atmospheric and less sensually focused than *Renoir*'s. The *Cleveland Museum of Art* and related institutions hold important Argenteuil garden figures from this moment."
"Claude_Monet","Claude Monet_1865_The Headland of the Heve at Low Tide.jpg","The Headland of the Heve at Low Tide","1865","Claude Monet","1840–1926","Oil on canvas","**Monet** painted the *Cap de la Hève* — the chalk headland north of the *Seine* estuary at *Le Havre* — in this early, large canvas that was accepted at the *1865 Salon*. At twenty-four years old, **Monet** was exhibiting at the official Salon for the first time alongside his friend *Frédéric Bazille*, and the *Héve* painting attracted favorable notice from critics including *Paul Mantz*, who praised ***'a bold manner of seeing things and of compelling the reader's attention'***. The low-tide vantage reveals the full extent of the chalk reef extending from the headland into the sea — a composition informed by **Monet**'s intimate knowledge of this stretch of coast since childhood. The *Kimbell Art Museum* in *Fort Worth* holds this significant early canvas."
"Claude_Monet","Claude Monet_1881_Bouquet of Gladiolas, Lilies and Daisies.jpg","Bouquet of Gladiolas, Lilies and Daisies","1881","Claude Monet","1840–1926","Oil on canvas","**Monet** made a sustained group of floral still lifes in 1881-82 during the *Vétheuil* years, working in the house during periods of bad weather and using the flower arrangements as subjects that allowed him to keep his eye and hand active while landscape painting was impossible. This tall arrangement of white lilies, red gladioli, and daisies in a simple vase exploits the ***vertical drama of cut flowers as an investigation of red-and-white color harmony*** in neutral ambient light. The gladiolus paintings are among the most direct and joyfully immediate of his still-life work — the flowers rendered with the same rapid notations he would use for water lily surfaces. These 1881-82 flower pictures were sold consistently to collectors through *Durand-Ruel*."
"Claude_Monet","Claude Monet_1874_The Studio Boat.jpg","The Studio Boat","1874","Claude Monet","1840–1926","Oil on canvas","**Monet** equipped a broad flat-bottomed boat with a small cabin-studio in the early *Argenteuil* years, allowing him to work from the middle of the *Seine* and study the water surface at close range. He celebrated this floating studio in at least one direct painting of the boat itself — seen moored before a bank of trees — that functions both as a record of his working method and as ***a self-portrait by proxy, the boat as the extension of the painter's body into the river landscape***. *Auguste Renoir* painted **Monet** at work on exactly such a boat in a now-famous canvas. The studio boat concept had been used by the *Barbizon* painter *Daubigny*, from whom **Monet** consciously adapted it, and by *Daubigny*'s son Karl who was **Monet**'s friend. The *Neue Pinakothek* in *Munich* holds this canvas."
"Claude_Monet","Claude Monet_1882_Low Tide at Pourville, near Dieppe.jpg","Low Tide at Pourville, near Dieppe","1882","Claude Monet","1840–1926","Oil on canvas","**Monet**'s extended stay at *Pourville* in 1882 yielded a group of low-tide views that are among the quietest and most tonally understated of his *Normandy* coastal paintings. At low tide the *Norman* coast reveals long expanses of wet chalk sand and pebble — a near-featureless expanse that imposes a ***horizontal infinity of grey, silver, and pale gold*** that challenges **Monet**'s compositional intelligence. He resolved the problem through extreme reduction: a high tide line of dark seaweed, the receding wet shingle, and the chalk cliff edge provide the only vertical markers against the vast beach and sky. The resulting canvases are among the most meditative of his entire coastal oeuvre."
"Claude_Monet","Claude Monet_c.1883-1885_Aiguille and Porte d'Aval, Etretat - Sunset.jpg","Aiguille and Porte d'Aval, Etretat - Sunset","c.1883-1885","Claude Monet","1840–1926","Oil on canvas","The *Needle* rock — *l'Aiguille* — rising from the sea at *Étretat* framing against the vast arch of the *Porte d'Aval* was one of **Monet**'s favorite compositions from his multiple *Étretat* campaigns of 1883 and 1885. This version, caught in the dramatic warm light of sunset, transforms the geological forms into silhouettes of deep orange-brown against an incandescent sky. ***The geological sublimity of the site — ancient chalk eroded into the shapes of doorways and needles — resonates with the Japanese aesthetic of 'scenic spots' that Monet absorbed from his print collection***. He worked with obsessive attention to the changing light on these forms, producing at least four major canvases of the needle-and-arch combination across his *Étretat* visits."
"Claude_Monet","Claude Monet_1866_Fishing Boats at Honfleur.jpg","Fishing Boats at Honfleur","1866","Claude Monet","1840–1926","Oil on canvas","**Monet** painted the working harbor of *Honfleur* at the mouth of the *Seine* estuary throughout the mid-1860s, capturing the fishing fleet moored between campaigns at sea. *Honfleur* was also significant as the home port of his formative mentor *Eugène Boudin*, who had first persuaded the teenage **Monet** to paint out of doors in the early 1860s. The harbor views of 1866 show the distinctive Norman *bisquines* and luggers in full detail, the masts and rigging creating ***the complex vertical geometry that appealed to nineteenth-century marine painters from Courbet to Boudin***. These early harbor paintings are important documents of **Monet**'s last years before his style broke decisively from academic marine convention."
"Claude_Monet","Claude Monet_1882_Cliff at Dieppe.jpg","Cliff at Dieppe","1882","Claude Monet","1840–1926","Oil on canvas","**Monet**'s treatment of the chalk cliff face at *Dieppe* from his various 1882 coastal campaigns demonstrates the versatility of a motif he exploited across dozens of canvases over thirty years. The *Dieppe* cliffs rise more steeply and with less of the quirky geological character of the *Étretat* arches, presenting a more austere compositional challenge — ***a near-vertical wall of chalk occupying much of the canvas, its pale surface absorbing and reflecting the grey-blue Atlantic light***. He varied his vantage from beach level to clifftop to achieve different structural effects. A major exhibition of his *Normandy* coast paintings was held at *Durand-Ruel* in 1883."
"Claude_Monet","Claude Monet_1874_The Railway Bridge at Argenteuil.jpg","The Railway Bridge at Argenteuil","1874","Claude Monet","1840–1926","Oil on canvas","The iron railway bridge at *Argenteuil* appears in this 1874 canvas in high summer, the slender steel trusses silhouetted against a luminous sky with sailing boats on the *Seine* below. **Monet** specifically celebrated the modernity of the railway infrastructure as a subject worthy of aesthetic attention at a time when academic painting still largely confined itself to historical, mythological, and approved landscape subjects. ***The bridge is rendered not as an intrusion on pastoral beauty but as a constituent element of the industrial Seine valley's specific light and atmosphere.*** The *1874* date places this canvas in the immediate creative aftermath of the first Impressionist exhibition, when the group's aesthetic program was at its most productively articulated."
"Claude_Monet","Claude Monet_c.1864_Trees by the Sea.jpg","Trees by the Sea","c.1864","Claude Monet","1840–1926","Oil on canvas","This early seascape, painted around 1864 during **Monet**'s formative years along the *Normandy* coast, shows the straightforward influence of his mentors *Eugène Boudin* and the Dutch painter *Jongkind* — both of whom emphasized working directly from nature with the freshness of first observation. The trees at the cliff's edge — battered by prevailing westerly winds into the characteristic leaning forms of the *Norman* clifftop — serve as framing devices against a broad sea horizon. ***The painting already reveals the intense observation of how wind moves vegetation and how sea light differs categorically from inland light*** that would define **Monet**'s mature practice. These *Normandy* coastal studies of the early 1860s provided the technical and perceptual foundation for the *Étretat*, *Étretat*, and *Belle-Île* campaigns of the 1880s."
"Claude_Monet","Claude Monet_1873_The Artist's Family in the Garden.jpg","The Artist's Family in the Garden","1873","Claude Monet","1840–1926","Oil on canvas","**Monet** painted his everyday domestic world at *Argenteuil* with an intimacy that suggests the *Japanese* tradition of domestic genre painting, translated into the *Impressionist* vocabulary of broken light and rapid notation. This garden view — with Camille, Jean, and possibly Alice Hoschedé's children among the flower beds — shows ***the family absorbed into the summer garden as naturally as the flowers themselves, human presence and horticulture merged in a single luminous moment***. The *Argenteuil* garden pictures of 1872-76 are among the most warmly human of **Monet**'s output; they capture a period of relative domestic stability and happiness before the financial and personal crises of the late 1870s. The *Walters Art Museum* in *Baltimore* holds a closely related family garden painting."
"Claude_Monet","Claude Monet_1882_Two Vases with Chrysanthemums.jpg","Two Vases with Chrysanthemums","1882","Claude Monet","1840–1926","Oil on canvas","**Monet**'s chrysanthemum paintings of the early 1880s demonstrate his ability to find new pictorial problems in a familiar subject — in this case by doubling the arrangement with two vases, creating a ***bilateral symmetry that is then disrupted by the difference in color, mass, and height between the two bouquets***. The painting belongs to the same *Vétheuil*/*Normandy* period floral still-life group as the *Bouquet of Gladiolas* and the *Vase of Flowers* canvases, all made partly as marketable studio pieces during winters when outdoor campaigns were impossible. **Monet**'s interest in the chrysanthemum specifically may owe something to *Japanese* art, where the flower is a central motif of autumn imagery. These chrysanthemum studies sell consistently at auction and are represented in major collections worldwide."
